{
  "schema_version": "1.0.0",
  "script_id": "space_station_normal_baseline_v1",
  "script_name": "空间站普通基础通关脚本",
  "game_mode": "tower_defense",
  "map": {
    "map_id": "space_station",
    "map_name": "空间站",
    "difficulty": "normal",
    "strategy_id": "baseline",
    "base_resolution": {
      "width": 1920,
      "height": 1080
    },
    "coordinate_mode": "region_screen_ratio",
    "initial_view": {
      "type": "fixed_after_open_map",
      "origin_region_id": "origin"
    }
  },
  "runtime": {
    "max_run_minutes": 30,
    "default_action_timeout_ms": 8000,
    "default_retry_count": 2,
    "default_resource_policy": "wait",
    "default_wait_resource_timeout_ms": 30000,
    "wait_after_pan_ms": 800,
    "wait_after_place_ms": 600,
    "wait_after_remove_ms": 600,
    "wait_after_upgrade_ms": 1000,
    "reset_view_on_retry": true
  },
  "recognition": {
    "rois": {
      "wave": {
        "x_ratio": 0.42,
        "y_ratio": 0.03,
        "w_ratio": 0.12,
        "h_ratio": 0.04
      },
      "resource": {
        "x_ratio": 0.72,
        "y_ratio": 0.03,
        "w_ratio": 0.1,
        "h_ratio": 0.04
      },
      "core_hp": {
        "x_ratio": 0.48,
        "y_ratio": 0.08,
        "w_ratio": 0.12,
        "h_ratio": 0.04
      },
      "map_ui_indicator": {
        "x_ratio": 0.02,
        "y_ratio": 0.02,
        "w_ratio": 0.12,
        "h_ratio": 0.08
      },
      "place_error_tip": {
        "x_ratio": 0.3,
        "y_ratio": 0.7,
        "w_ratio": 0.4,
        "h_ratio": 0.12
      }
    },
    "multi_frame": {
      "wave_frames": 5,
      "resource_frames": 3,
      "slot_state_frames": 3
    }
  },
  "traps": [
    {
      "trap_id": "slow_trap",
      "trap_name": "减速陷阱",
      "select_key": "1",
      "upgrade_key": "1",
      "upgrade_hold_ms": 4000,
      "cost": 500,
      "upgrade_cost": 1000,
      "max_level": 3,
      "upgrade_mode": "all_same_type"
    },
    {
      "trap_id": "damage_trap",
      "trap_name": "输出陷阱",
      "select_key": "2",
      "upgrade_key": "2",
      "upgrade_hold_ms": 4000,
      "cost": 800,
      "upgrade_cost": 1500,
      "max_level": 3,
      "upgrade_mode": "all_same_type"
    }
  ],
  "regions": [
    {
      "region_id": "origin",
      "name": "初始视野",
      "description": "按 O 打开地图后的默认视野",
      "enter_actions": []
    },
    {
      "region_id": "entrance_left",
      "name": "左入口区域",
      "description": "左侧入口布防区",
      "enter_actions": [
        {
          "type": "pan_map",
          "direction": "left",
          "distance_ratio": 0.3,
          "duration_ms": 600,
          "repeat": 1
        }
      ]
    }
  ],
  "slots": [
    {
      "slot_id": "A01",
      "name": "左入口减速位1",
      "region_id": "entrance_left",
      "position": {
        "x_ratio": 0.452,
        "y_ratio": 0.561
      },
      "precision": {
        "click_tolerance_px": 6,
        "allow_micro_adjust": true,
        "micro_adjust_pattern": "cross_5_points",
        "micro_adjust_step_px": 4
      },
      "slot_type": "ground",
      "default_trap": "slow_trap",
      "verify": {
        "empty_method": "template_or_color",
        "occupied_method": "image_change",
        "level_method": "level_badge",
        "check_area": {
          "x_ratio": 0.435,
          "y_ratio": 0.545,
          "w_ratio": 0.035,
          "h_ratio": 0.035
        }
      }
    },
    {
      "slot_id": "A02",
      "name": "左入口输出位1",
      "region_id": "entrance_left",
      "position": {
        "x_ratio": 0.502,
        "y_ratio": 0.561
      },
      "precision": {
        "click_tolerance_px": 6,
        "allow_micro_adjust": true,
        "micro_adjust_pattern": "cross_5_points",
        "micro_adjust_step_px": 4
      },
      "slot_type": "ground",
      "default_trap": "damage_trap",
      "verify": {
        "empty_method": "template_or_color",
        "occupied_method": "image_change",
        "level_method": "level_badge",
        "check_area": {
          "x_ratio": 0.485,
          "y_ratio": 0.545,
          "w_ratio": 0.035,
          "h_ratio": 0.035
        }
      }
    }
  ],
  "waves": [
    {
      "wave": 1,
      "name": "第1波初始布防",
      "execute_once": true,
      "trigger": {
        "type": "wave_eq",
        "value": 1
      },
      "actions": [
        {
          "type": "pan_to_region",
          "region_id": "entrance_left",
          "retry": {
            "max_count": 2,
            "reset_view_before_retry": true
          }
        },
        {
          "type": "place_trap",
          "name": "放置左入口减速",
          "trap_id": "slow_trap",
          "slot_id": "A01",
          "conditions": {
            "resource_gte": 500,
            "slot_empty": "A01"
          },
          "on_condition_failed": {
            "policy": "wait",
            "timeout_ms": 30000,
            "then": "retry_condition"
          },
          "verify": {
            "type": "slot_has_trap",
            "slot_id": "A01",
            "trap_id": "slow_trap",
            "required": true
          },
          "retry": {
            "max_count": 3,
            "interval_ms": 800,
            "reset_view_before_retry": true,
            "micro_adjust_on_retry": true
          },
          "on_fail": {
            "policy": "skip"
          }
        },
        {
          "type": "place_trap",
          "name": "放置左入口输出",
          "trap_id": "damage_trap",
          "slot_id": "A02",
          "conditions": {
            "resource_gte": 800,
            "slot_empty": "A02"
          },
          "on_condition_failed": {
            "policy": "wait",
            "timeout_ms": 30000,
            "then": "retry_condition"
          },
          "verify": {
            "type": "slot_has_trap",
            "slot_id": "A02",
            "trap_id": "damage_trap",
            "required": true
          },
          "retry": {
            "max_count": 3,
            "interval_ms": 800,
            "reset_view_before_retry": true,
            "micro_adjust_on_retry": true
          },
          "on_fail": {
            "policy": "skip"
          }
        },
        {
          "type": "log",
          "message": "第1波初始布防完成"
        }
      ]
    },
    {
      "wave": 2,
      "name": "第2波升级输出陷阱",
      "execute_once": true,
      "trigger": {
        "type": "wave_eq",
        "value": 2
      },
      "actions": [
        {
          "type": "upgrade_trap",
          "name": "升级输出陷阱到2级",
          "trap_id": "damage_trap",
          "target_level": 2,
          "conditions": {
            "resource_gte": 1500,
            "trap_level_lt": {
              "trap_id": "damage_trap",
              "level": 2
            }
          },
          "on_condition_failed": {
            "policy": "wait",
            "timeout_ms": 30000,
            "then": "retry_condition"
          },
          "execute": {
            "method": "hold_key",
            "key": "2",
            "hold_ms": 4000
          },
          "verify": {
            "type": "trap_level_gte",
            "trap_id": "damage_trap",
            "level": 2,
            "required": false
          },
          "retry": {
            "max_count": 2,
            "interval_ms": 1000
          },
          "on_fail": {
            "policy": "skip"
          }
        }
      ]
    },
    {
      "wave": 5,
      "name": "第5波调整防线",
      "execute_once": true,
      "trigger": {
        "type": "wave_eq",
        "value": 5
      },
      "actions": [
        {
          "type": "pan_to_region",
          "region_id": "entrance_left"
        },
        {
          "type": "remove_trap",
          "name": "拆除左入口减速位1",
          "slot_id": "A01",
          "conditions": {
            "slot_occupied": "A01",
            "wave_gte": 5
          },
          "on_condition_failed": {
            "policy": "skip"
          },
          "execute": {
            "method": "custom_steps",
            "steps": []
          },
          "verify": {
            "type": "slot_empty",
            "slot_id": "A01",
            "required": true
          },
          "retry": {
            "max_count": 2,
            "interval_ms": 800,
            "reset_view_before_retry": true
          },
          "on_fail": {
            "policy": "skip"
          }
        }
      ]
    }
  ],
  "boss_reserved": {
    "enabled": false,
    "description": "当前版本不处理 BOSS 专项逻辑，仅预留"
  },
  "metadata": {
    "author": "",
    "created_at": "2026-05-12",
    "updated_at": "2026-05-12",
    "description": "空间站普通难度基础通关脚本"
  }
}